{
  "problem": {
    "id": "e91ec728-4597-5dfb-9d19-7c4ba17138b7",
    "slug": "run-widths",
    "version": "3",
    "title": "Run Widths",
    "difficulty": "easy",
    "tags": ["arrays"],
    "statementMarkdown": "Return the lengths of the maximal contiguous runs of equal values in `values`, in order. Empty input returns an empty list.",
    "examples": [
      {
        "args": [[1, 1, 2, 2, 2, 1]],
        "expected": [2, 3, 1],
        "explanation": "The runs contain two 1s, three 2s, and one 1."
      },
      {
        "args": [[1, 2, 3]],
        "expected": [1, 1, 1],
        "explanation": "Each value begins a new run."
      },
      {
        "args": [[]],
        "expected": [],
        "explanation": "No values create no runs."
      }
    ],
    "constraints": [
      {
        "kind": "range",
        "target": {
          "parameter": "values",
          "projection": "length"
        },
        "min": 0,
        "max": 10000
      },
      {
        "kind": "range",
        "target": {
          "parameter": "values",
          "projection": "elements"
        },
        "min": -2147483648,
        "max": 2147483647
      }
    ],
    "signature": {
      "className": "Solution",
      "methodName": "runWidths",
      "parameters": [
        {
          "name": "values",
          "type": "list<int>"
        }
      ],
      "returnType": "list<int>"
    },
    "starterSource": "from typing import Optional\nfrom quorem_types import ListNode, TreeNode\n\nclass Solution:\n    def runWidths(self, values: list[int]) -> list[int]:\n        pass\n",
    "runtimeRevision": "python-3.12-v1",
    "limits": {
      "wallTimeMs": 2000,
      "memoryBytes": 268435456,
      "outputBytes": 65536,
      "maxProcesses": 16,
      "maxCollectionElements": 10000,
      "maxNestingDepth": 100
    },
    "languages": []
  },
  "hiddenCases": [
    {
      "args": [[]],
      "expected": []
    },
    {
      "args": [[1]],
      "expected": [1]
    },
    {
      "args": [[1, 1, 2, 2, 2, 1]],
      "expected": [2, 3, 1]
    },
    {
      "args": [[0, 0, 0, 0, 0, 0, 0, 0]],
      "expected": [8]
    },
    {
      "args": [[1, 2, 3]],
      "expected": [1, 1, 1]
    },
    {
      "args": [[-1, -1, -2]],
      "expected": [2, 1]
    },
    {
      "args": [[0, 1, 2, 3, 4, 5, 6, 7, 8, 9, 10, 11, 12, 13, 14, 15, 16, 17, 18, 19]],
      "expected": [1, 1, 1, 1, 1, 1, 1, 1, 1, 1, 1, 1, 1, 1, 1, 1, 1, 1, 1, 1]
    },
    {
      "args": [[1, 2, 1, 2, 1, 2, 1, 2, 1, 2, 1, 2, 1, 2, 1, 2, 1, 2, 1, 2]],
      "expected": [1, 1, 1, 1, 1, 1, 1, 1, 1, 1, 1, 1, 1, 1, 1, 1, 1, 1, 1, 1]
    },
    {
      "args": [
        [
          3, 3, 3, 3, 3, 3, 3, 3, 3, 3, 3, 3, 3, 3, 3, 3, 3, 3, 3, 3, 3, 3, 3, 3, 3, 3, 3, 3, 3, 3,
          3, 3, 3, 3, 3, 3, 3, 3, 3, 3, 3, 3, 3, 3, 3, 3, 3, 3, 3, 3, 3, 3, 3, 3, 3, 3, 3, 3, 3, 3,
          3, 3, 3, 3, 3, 3, 3, 3, 3, 3, 3, 3, 3, 3, 3, 3, 3, 3, 3, 3, 3, 3, 3, 3, 3, 3, 3, 3, 3, 3,
          3, 3, 3, 3, 3, 3, 3, 3, 3, 3
        ]
      ],
      "expected": [100]
    },
    {
      "args": [[0, 0, 1, 0]],
      "expected": [2, 1, 1]
    },
    {
      "args": [[-2147483648, 2147483647]],
      "expected": [1, 1]
    },
    {
      "args": [[4, 4, 4, 5, 5]],
      "expected": [3, 2]
    },
    {
      "args": [[9, 8, 8, 7, 7, 7]],
      "expected": [1, 2, 3]
    },
    {
      "args": [[2, 2, 1, 1, 2, 2]],
      "expected": [2, 2, 2]
    },
    {
      "args": [[0]],
      "expected": [1]
    },
    {
      "args": [
        [
          7, 7, 7, 7, 7, 7, 7, 7, 7, 7, 7, 7, 7, 7, 7, 7, 7, 7, 7, 7, 7, 7, 7, 7, 7, 7, 7, 7, 7, 7,
          7, 7, 7, 7, 7, 7, 7, 7, 7, 7, 7, 7, 7, 7, 7, 7, 7, 7, 7, 7, 7, 7, 7, 7, 7, 7, 7, 7, 7, 7,
          7, 7, 7, 7, 7, 7, 7, 7, 7, 7, 7, 7, 7, 7, 7, 7, 7, 7, 7, 7, 7, 7, 7, 7, 7, 7, 7, 7, 7, 7,
          7, 7, 7, 7, 7, 7, 7, 7, 7, 7, 7, 7, 7, 7, 7, 7, 7, 7, 7, 7, 7, 7, 7, 7, 7, 7, 7, 7, 7, 7,
          7, 7, 7, 7, 7, 7, 7, 7, 7, 7, 7, 7, 7, 7, 7, 7, 7, 7, 7, 7, 7, 7, 7, 7, 7, 7, 7, 7, 7, 7,
          7, 7, 7, 7, 7, 7, 7, 7, 7, 7, 7, 7, 7, 7, 7, 7, 7, 7, 7, 7, 7, 7, 7, 7, 7, 7, 7, 7, 7, 7,
          7, 7, 7, 7, 7, 7, 7, 7, 7, 7, 7, 7, 7, 7, 7, 7, 7, 7, 7, 7, 7, 7, 7, 7, 7, 7, 7, 7, 7, 7,
          7, 7, 7, 7, 7, 7, 7, 7, 7, 7, 7, 7, 7, 7, 7, 7, 7, 7, 7, 7, 7, 7, 7, 7, 7, 7, 7, 7, 7, 7,
          7, 7, 7, 7, 7, 7, 7, 7, 7, 7, 7, 7, 7, 7, 7, 7, 7, 7, 7, 7, 7, 7, 7, 7, 7, 7, 7, 7, 7, 7,
          7, 7, 7, 7, 7, 7, 7, 7, 7, 7, 7, 7, 7, 7, 7, 7, 7, 7, 7, 7, 7, 7, 7, 7, 7, 7, 7, 7, 7, 7,
          7, 7, 7, 7, 7, 7, 7, 7, 7, 7, 7, 7, 7, 7, 7, 7, 7, 7, 7, 7, 7, 7, 7, 7, 7, 7, 7, 7, 7, 7,
          7, 7, 7, 7, 7, 7, 7, 7, 7, 7, 7, 7, 7, 7, 7, 7, 7, 7, 7, 7, 7, 7, 7, 7, 7, 7, 7, 7, 7, 7,
          7, 7, 7, 7, 7, 7, 7, 7, 7, 7, 7, 7, 7, 7, 7, 7, 7, 7, 7, 7, 7, 7, 7, 7, 7, 7, 7, 7, 7, 7,
          7, 7, 7, 7, 7, 7, 7, 7, 7, 7, 7, 7, 7, 7, 7, 7, 7, 7, 7, 7, 7, 7, 7, 7, 7, 7, 7, 7, 7, 7,
          7, 7, 7, 7, 7, 7, 7, 7, 7, 7, 7, 7, 7, 7, 7, 7, 7, 7, 7, 7, 7, 7, 7, 7, 7, 7, 7, 7, 7, 7,
          7, 7, 7, 7, 7, 7, 7, 7, 7, 7, 7, 7, 7, 7, 7, 7, 7, 7, 7, 7, 7, 7, 7, 7, 7, 7, 7, 7, 7, 7,
          7, 7, 7, 7, 7, 7, 7, 7, 7, 7, 7, 7, 7, 7, 7, 7, 7, 7, 7, 7, 7, 7, 7, 7, 7, 7, 7, 7, 7, 7,
          7, 7, 7, 7, 7, 7, 7, 7, 7, 7, 7, 7, 7, 7, 7, 7, 7, 7, 7, 7, 7, 7, 7, 7, 7, 7, 7, 7, 7, 7,
          7, 7, 7, 7, 7, 7, 7, 7, 7, 7, 7, 7, 7, 7, 7, 7, 7, 7, 7, 7, 7, 7, 7, 7, 7, 7, 7, 7, 7, 7,
          7, 7, 7, 7, 7, 7, 7, 7, 7, 7, 7, 7, 7, 7, 7, 7, 7, 7, 7, 7, 7, 7, 7, 7, 7, 7, 7, 7, 7, 7,
          7, 7, 7, 7, 7, 7, 7, 7, 7, 7, 7, 7, 7, 7, 7, 7, 7, 7, 7, 7, 7, 7, 7, 7, 7, 7, 7, 7, 7, 7,
          7, 7, 7, 7, 7, 7, 7, 7, 7, 7, 7, 7, 7, 7, 7, 7, 7, 7, 7, 7, 7, 7, 7, 7, 7, 7, 7, 7, 7, 7,
          7, 7, 7, 7, 7, 7, 7, 7, 7, 7, 7, 7, 7, 7, 7, 7, 7, 7, 7, 7, 7, 7, 7, 7, 7, 7, 7, 7, 7, 7,
          7, 7, 7, 7, 7, 7, 7, 7, 7, 7, 7, 7, 7, 7, 7, 7, 7, 7, 7, 7, 7, 7, 7, 7, 7, 7, 7, 7, 7, 7,
          7, 7, 7, 7, 7, 7, 7, 7, 7, 7, 7, 7, 7, 7, 7, 7, 7, 7, 7, 7, 7, 7, 7, 7, 7, 7, 7, 7, 7, 7,
          7, 7, 7, 7, 7, 7, 7, 7, 7, 7, 7, 7, 7, 7, 7, 7, 7, 7, 7, 7, 7, 7, 7, 7, 7, 7, 7, 7, 7, 7,
          7, 7, 7, 7, 7, 7, 7, 7, 7, 7, 7, 7, 7, 7, 7, 7, 7, 7, 7, 7, 7, 7, 7, 7, 7, 7, 7, 7, 7, 7,
          7, 7, 7, 7, 7, 7, 7, 7, 7, 7, 7, 7, 7, 7, 7, 7, 7, 7, 7, 7, 7, 7, 7, 7, 7, 7, 7, 7, 7, 7,
          7, 7, 7, 7, 7, 7, 7, 7, 7, 7, 7, 7, 7, 7, 7, 7, 7, 7, 7, 7, 7, 7, 7, 7, 7, 7, 7, 7, 7, 7,
          7, 7, 7, 7, 7, 7, 7, 7, 7, 7, 7, 7, 7, 7, 7, 7, 7, 7, 7, 7, 7, 7, 7, 7, 7, 7, 7, 7, 7, 7,
          7, 7, 7, 7, 7, 7, 7, 7, 7, 7, 7, 7, 7, 7, 7, 7, 7, 7, 7, 7, 7, 7, 7, 7, 7, 7, 7, 7, 7, 7,
          7, 7, 7, 7, 7, 7, 7, 7, 7, 7, 7, 7, 7, 7, 7, 7, 7, 7, 7, 7, 7, 7, 7, 7, 7, 7, 7, 7, 7, 7,
          7, 7, 7, 7, 7, 7, 7, 7, 7, 7, 7, 7, 7, 7, 7, 7, 7, 7, 7, 7, 7, 7, 7, 7, 7, 7, 7, 7, 7, 7,
          7, 7, 7, 7, 7, 7, 7, 7, 7
        ]
      ],
      "expected": [999]
    },
    {
      "args": [[5, -5, 5]],
      "expected": [1, 1, 1]
    },
    {
      "args": [[1, 1, 1, 1, 2]],
      "expected": [4, 1]
    },
    {
      "args": [[3, 2, 1, 1]],
      "expected": [1, 1, 2]
    },
    {
      "args": [[0, 0, 0, -1, -1, 0]],
      "expected": [3, 2, 1]
    }
  ],
  "comparator": "ordered",
  "attribution": "Original Quorem statement and fixture corpus, authored for this project.",
  "implementations": [
    {
      "language": "python",
      "starterSource": "from typing import Optional\nfrom quorem_types import ListNode, TreeNode\n\nclass Solution:\n    def runWidths(self, values: list[int]) -> list[int]:\n        pass\n",
      "runtimeRevision": "python-3.12-v1",
      "harnessRevision": "quorem-harness-v2",
      "referenceSource": "def solve(values):\n    result = []\n    for i, value in enumerate(values):\n        if i == 0 or value != values[i-1]: result.append(1)\n        else: result[-1] += 1\n    return result\nclass Solution:\n    def runWidths(self, values):\n        return solve(values)\n"
    }
  ],
  "solutions": []
}
